{"schema_version":1,"artifact_id":"synthetic-binding-manifest-v1","artifact_created_wall_ns":1000000000,"bindings":[{"canonical_match_id":"synthetic-match-001","provider":{"sport":"tennis","competition_kind":"real","competitor_count":2,"source_id":"provider-a","revision_domain_id":"revision-a","source_lineage_sha256":"aaaaaaaaaaaaaaaaaaaaaaaaaaaaaaaaaaaaaaaaaaaaaaaaaaaaaaaaaaaaaaaa","match_id":"provider-match-000","home_player":{"provider_player_id":"provider-home-000","canonical_player_id":"canonical-home-000","display_name":"Synthetic Home 000","participant_type":"player","participant_status":"confirmed"},"away_player":{"provider_player_id":"provider-away-000","canonical_player_id":"canonical-away-000","display_name":"Synthetic Away 000","participant_type":"player","participant_status":"confirmed"},"scheduled_start_wall_ns":2000000000,"snapshot_sha256":"bbbbbbbbbbbbbbbbbbbbbbbbbbbbbbbbbbbbbbbbbbbbbbbbbbbbbbbbbbbbbbbb","snapshot_captured_wall_ns":900000000},"competition":{"tournament_id":"tournament-1","season_id":"season-2026","draw_id":"draw-main","round_id":"round-000","tour_id":"tour-atp","tier_id":"tier-250","surface":"hard","tournament_name":"Synthetic Open"},"match":{"match_type":"singles","product":"match_winner","format":"standard_advantage_bo3_tb7_all_sets","start_tolerance_ns":900000000000},"kalshi":{"series_ticker":"TENNISSERIES","event_ticker":"TENNISMATCH000","event_id":"event-000","scheduled_start_wall_ns":2000000100,"event_sha256":"cccccccccccccccccccccccccccccccccccccccccccccccccccccccccccccccc","event_captured_wall_ns":900000000,"event_catalog_sha256":"e4587dfe24d7399215713bc95ac2f9a61f77abdb8a92b72bf6ebb71a574455d9","route_authority":"direct_yes_only","markets":[{"market_ticker":"TENNIS000HOME","market_id":"market-000-home","yes_player_side":"home","yes_provider_player_id":"provider-home-000","yes_canonical_player_id":"canonical-home-000","yes_outcome":"wins_match","membership":{"series_ticker":"TENNISSERIES","event_ticker":"TENNISMATCH000","event_id":"event-000","market_ticker":"TENNIS000HOME","market_id":"market-000-home","product":"match_winner","event_catalog_sha256":"e4587dfe24d7399215713bc95ac2f9a61f77abdb8a92b72bf6ebb71a574455d9","source_id":"kalshi-event-catalog","source_version":"v2","captured_wall_ns":800000000,"membership_evidence_sha256":"a006e7bdf9967fd0724ab5cd4646c3edac8ac7ad9e81c0b04ea7c57fa6c25584","membership_projection_sha256":"ed89d257a4d252bac0883775f6ba9a9fddc5d3f8adbf1ae78aa5b22404e6421e"},"settlement":{"result_authority":"kalshi_finalized_market_result","natural_completion":"yes_if_named_player_final_winner","retirement_after_point":"yes_if_named_player_final_winner","walkover_before_point":"void","default_after_point":"yes_if_named_player_final_winner","disqualification_after_point":"void","cancellation":"void","postponement":"defer","abandonment":"await_latest_finalized_result","amendment":"await_latest_finalized_result","void_treatment":"no_directional_settlement","raw_rules_sha256":"aac70aac6b2aebf2eaf17fa45be36c9672484f4bd048c7adacc5909c0d353dc5","projection_sha256":"00f24b40555cad09165601ecc6302b879932bbfda68e9361b73764c5b6d83bbc"},"market_evidence":{"source_id":"kalshi-market-api","source_version":"v2","captured_wall_ns":850000000,"market_text":"Synthetic HOME player wins match","market_text_sha256":"8dbc1f145c2ef83e9e3f399d8524cdf56af88617b10e6416befc7c3be8f18665","settlement_rule_text":"Synthetic settlement rules 000 HOME","settlement_rule_text_sha256":"aac70aac6b2aebf2eaf17fa45be36c9672484f4bd048c7adacc5909c0d353dc5"}},{"market_ticker":"TENNIS000AWAY","market_id":"market-000-away","yes_player_side":"away","yes_provider_player_id":"provider-away-000","yes_canonical_player_id":"canonical-away-000","yes_outcome":"wins_match","membership":{"series_ticker":"TENNISSERIES","event_ticker":"TENNISMATCH000","event_id":"event-000","market_ticker":"TENNIS000AWAY","market_id":"market-000-away","product":"match_winner","event_catalog_sha256":"e4587dfe24d7399215713bc95ac2f9a61f77abdb8a92b72bf6ebb71a574455d9","source_id":"kalshi-event-catalog","source_version":"v2","captured_wall_ns":800000000,"membership_evidence_sha256":"0f9e5509e7a626a98dbfdd0346c8f96e170aeb2b39fbccdfadd419cd70d13b0e","membership_projection_sha256":"dc1dcd28c79e7db99ac3073b5cab905926f1432091ffb085286de4c1247c38f2"},"settlement":{"result_authority":"kalshi_finalized_market_result","natural_completion":"yes_if_named_player_final_winner","retirement_after_point":"yes_if_named_player_final_winner","walkover_before_point":"void","default_after_point":"yes_if_named_player_final_winner","disqualification_after_point":"void","cancellation":"void","postponement":"defer","abandonment":"await_latest_finalized_result","amendment":"await_latest_finalized_result","void_treatment":"no_directional_settlement","raw_rules_sha256":"5162fbe13e58deffce3830e35e240b3add24492070c9c0b476f394775752a085","projection_sha256":"0949c348a721266d3f1e0b17237d7f2211d0de5065a476287be63529572de0c7"},"market_evidence":{"source_id":"kalshi-market-api","source_version":"v2","captured_wall_ns":850000000,"market_text":"Synthetic AWAY player wins match","market_text_sha256":"a11c7a9b2d3b569b4200225d9090141e006079009c4477096180708df5d9c00e","settlement_rule_text":"Synthetic settlement rules 000 AWAY","settlement_rule_text_sha256":"5162fbe13e58deffce3830e35e240b3add24492070c9c0b476f394775752a085"}}],"authorized_routes":[{"player_side":"home","market_ticker":"TENNIS000HOME","contract_side":"yes"},{"player_side":"away","market_ticker":"TENNIS000AWAY","contract_side":"yes"}]}}]}
